{
  "$schema": "https://json-schema.org/draft/2020-12/schema",
  "title": "Babel Agent Handoff",
  "type": "object",
  "additionalProperties": false,
  "required": [
    "from",
    "to",
    "task",
    "assumptions",
    "artifacts",
    "open_questions",
    "next_step",
    "message"
  ],
  "properties": {
    "from": {
      "type": "string",
      "minLength": 1
    },
    "to": {
      "type": "string",
      "minLength": 1
    },
    "task": {
      "type": "string",
      "minLength": 1
    },
    "assumptions": {
      "type": "array",
      "items": {
        "type": "string"
      }
    },
    "artifacts": {
      "type": "array",
      "items": {
        "type": "string"
      }
    },
    "open_questions": {
      "type": "array",
      "items": {
        "type": "string"
      }
    },
    "next_step": {
      "type": "string",
      "minLength": 1
    },
    "message": {
      "type": "string",
      "minLength": 1
    }
  }
}
